{"schemaVersion":"uniclaw.workspace.record-envelope.v1","contractVersion":"uniclaw.workspace.contract.v1","recordId":"evidence-002","kind":"evidence","source":"dsh","authority":"dsh-host","taskInstanceId":"task-001","productSessionId":"ps-001","correlationId":"result-001","occurredAt":"2026-10-02T10:00:00Z","summary":"relative evidence reference","detailRef":{"refId":"evidence/foo.md","source":"dsh","detailType":"text"}}
