{"schemaVersion":"uniclaw.workspace.record-envelope.v1","contractVersion":"uniclaw.workspace.contract.v1","recordId":"trace-001","kind":"trace","source":"uniclaw","authority":"uniclaw-runtime","taskInstanceId":"task-001","productSessionId":"ps-001","hostSessionRef":{"host":"dsh","sessionId":"dsh-001"},"correlationId":"decision-001","occurredAt":"2026-10-02T10:00:00Z","summary":"decision completed","detailRef":{"refId":"detail-001","source":"uniclaw","detailType":"structured","revision":"r1"}}
